{"contractVersion":"1.0.0","correlationId":"00000000-0000-4000-8000-000000000001","causationId":"00000000-0000-4000-8000-000000000301","jobId":"00000000-0000-4000-8000-000000000301","attemptId":"00000000-0000-4000-8000-000000000401","messageType":"WORKER_PROGRESS","sequence":0,"occurredAt":"2026-07-15T00:00:01.000Z","stage":"CONVERT","status":"IN_PROGRESS","completedUnits":1,"totalUnits":2,"unit":"PAGES","message":"Converted page 1 of 2.","metrics":{"wallTimeMs":1000,"peakMemoryBytes":1000000,"bytesRead":1024,"bytesWritten":128}}
